name,can_multiattack,is_legendary,description_template,effect_ac,effect_hp,effect_damage,effect_attack
Amphibious,False,False,This creature can breathe air and water.,,,,
Bound to the Courts,False,False,"This creature has advantage on saving throws against being charmed, and magic can't put it to sleep.",,,,
Aggressive,False,False,"As a bonus action, this creature can move up to its speed toward a hostile feature it can see.",,,".05",
Ambusher,False,False,This creature has advantage on attack rolls against any creature it has surprised.,,,.05,
Constrict,True,False,"*Melee Weapon Atack:* +{prof + STR} to hit, reach 5 ft., one target. *Hit:* 7 ({size_mod}d4 + {STR}) bludgeoning damage. On a hit, if the target is {size} or smaller, it must make a DC {8 + prof + STR} Strength saving throw or be grappled.",1,,,
Frightful Presence,True,False,"Each creature of this creature's choice within 120 ft. that can hear or see it must make a DC {8 + prof + CHA} Wisdom saving throw or become frightened for 1 minute. A creature can repeat the saving throw at the end of each of its turns, ending the effect on itself on a success. If a creature's saving throw is successful or the effect ends for it, the creature is immune to this creature's Frightful Presence for the next 24 hours.",1,".25",,
Magic Resistance,False,False,This creature has advantage on saving throws against spells and other magical effects.,2,,,
Nimble Escape,False,False,This creature can take the Disengage or Hide action as a bonus action on each of its turns.,1,,,2
Pack Tactics,False,False,This creature has advantage on attack rolls against a target creature if at least one of the creature's allies is within 5 ft. of the target and the ally is not incapacitated.,,,,1
Parry,False,False,This creature adds {prof} to its AC against one melee attack that would hit it.,1,,,
Regeneration,False,False,"At the beginning of this creature's turn, it regains {prof + CON} hit points.",,".1",,
Aversion to Fire,False,False,"If this creature takes fire damage, it can't use its Regeneration feature on its next turn.",,,,
Aversion to Acid,False,False,"If this creature takes acid damage, it can't use its Regeneration feature on its next turn.",,,,
Relentless,False,False,"If this creature would be reduced to 0 hit points, it makes a DC {8 + prof} Constitution saving throw. On a successful saving throw, it survives with 1 hp instead.",,,.1,
Undead Fortitude,False,False,"If damage reduces this creature to 0 hit points, it must make a Constitution saving throw with a DC of 5 + the damage taken, unless the damage is radiant or from a critical hit. On a successful saving throw, it drops to 1 hp instead.",,.2,,
Stench,False,False,"Any other creature that starts its turn within 5 ft. of this creature must succeed on a DC {8 + CON + prof} saving throw or be poisoned until the start of that creature's next turn. On a successful saving throw, the creature is immune to the stench of creatures of this kind for 1 hour.",1,,,
Sunlight Sensitivity,False,False,"While in sunlight, this creature has disadvantage on attack rolls, as well as on Wisdom (Perception) checks that rely on sight.",,,,
Command Undead,False,False,"({prof - 1}/day) This creature targets one undead creature it can see. If the target has a CR of 1 or lower and has no class levels, this creature immediately assumes control over the target. The target obeys the verbal commands of this creature to the best of its ability for the next 24 hours.",,,,